{
  "$schema": "https://json-schema.org/draft/2020-12/schema",
  "type": "object",
  "properties": {
    "schema_version": {
      "const": "wtp.candidate/1"
    },
    "id": {
      "type": "string",
      "minLength": 1
    },
    "category": {
      "enum": [
        "Functional",
        "Input Validation",
        "Routing & Redirection",
        "UI / Rendering",
        "Other"
      ]
    },
    "url": {
      "type": "string",
      "format": "uri"
    },
    "element": {
      "type": [
        "string",
        "null"
      ]
    },
    "symptom": {
      "type": "string",
      "minLength": 1
    },
    "priority": {
      "enum": [
        "high",
        "medium",
        "low"
      ]
    },
    "initial_state": {
      "type": "string",
      "minLength": 1
    },
    "expected": {
      "type": "object",
      "properties": {
        "behavior": {
          "type": "string",
          "minLength": 1
        },
        "basis_type": {
          "enum": [
            "product_requirement",
            "standard",
            "inference",
            "unknown"
          ]
        },
        "basis": {
          "type": "string",
          "minLength": 1
        }
      },
      "required": [
        "behavior",
        "basis_type",
        "basis"
      ],
      "additionalProperties": false
    },
    "authorization": {
      "type": "object",
      "properties": {
        "origins": {
          "type": "array",
          "items": {
            "type": "string",
            "format": "uri"
          },
          "minItems": 1
        },
        "basis": {
          "type": "string",
          "minLength": 1
        },
        "actions_reviewed": {
          "const": true
        }
      },
      "required": [
        "origins",
        "basis",
        "actions_reviewed"
      ],
      "additionalProperties": false
    },
    "scenario": {
      "type": "array",
      "items": {
        "oneOf": [
          {
            "type": "object",
            "properties": {
              "action": {
                "const": "observe"
              }
            },
            "required": [
              "action"
            ],
            "additionalProperties": false
          },
          {
            "type": "object",
            "properties": {
              "action": {
                "const": "back"
              }
            },
            "required": [
              "action"
            ],
            "additionalProperties": false
          },
          {
            "type": "object",
            "properties": {
              "action": {
                "const": "forward"
              }
            },
            "required": [
              "action"
            ],
            "additionalProperties": false
          },
          {
            "type": "object",
            "properties": {
              "action": {
                "const": "goto"
              },
              "url": {
                "type": "string",
                "minLength": 1
              }
            },
            "required": [
              "action",
              "url"
            ],
            "additionalProperties": false
          },
          {
            "type": "object",
            "properties": {
              "action": {
                "const": "wait_for_url"
              },
              "url": {
                "type": "string",
                "minLength": 1
              }
            },
            "required": [
              "action",
              "url"
            ],
            "additionalProperties": false
          },
          {
            "type": "object",
            "properties": {
              "action": {
                "const": "click"
              },
              "locator": {
                "oneOf": [
                  {
                    "type": "object",
                    "properties": {
                      "css": {
                        "type": "string",
                        "minLength": 1
                      }
                    },
                    "required": [
                      "css"
                    ],
                    "additionalProperties": false
                  },
                  {
                    "type": "object",
                    "properties": {
                      "role": {
                        "type": "string",
                        "minLength": 1
                      },
                      "name": {
                        "type": "string",
                        "minLength": 1
                      }
                    },
                    "required": [
                      "role",
                      "name"
                    ],
                    "additionalProperties": false
                  }
                ]
              }
            },
            "required": [
              "action",
              "locator"
            ],
            "additionalProperties": false
          },
          {
            "type": "object",
            "properties": {
              "action": {
                "const": "fill"
              },
              "locator": {
                "oneOf": [
                  {
                    "type": "object",
                    "properties": {
                      "css": {
                        "type": "string",
                        "minLength": 1
                      }
                    },
                    "required": [
                      "css"
                    ],
                    "additionalProperties": false
                  },
                  {
                    "type": "object",
                    "properties": {
                      "role": {
                        "type": "string",
                        "minLength": 1
                      },
                      "name": {
                        "type": "string",
                        "minLength": 1
                      }
                    },
                    "required": [
                      "role",
                      "name"
                    ],
                    "additionalProperties": false
                  }
                ]
              },
              "value": {
                "type": "string"
              }
            },
            "required": [
              "action",
              "locator",
              "value"
            ],
            "additionalProperties": false
          },
          {
            "type": "object",
            "properties": {
              "action": {
                "const": "press"
              },
              "locator": {
                "oneOf": [
                  {
                    "type": "object",
                    "properties": {
                      "css": {
                        "type": "string",
                        "minLength": 1
                      }
                    },
                    "required": [
                      "css"
                    ],
                    "additionalProperties": false
                  },
                  {
                    "type": "object",
                    "properties": {
                      "role": {
                        "type": "string",
                        "minLength": 1
                      },
                      "name": {
                        "type": "string",
                        "minLength": 1
                      }
                    },
                    "required": [
                      "role",
                      "name"
                    ],
                    "additionalProperties": false
                  }
                ]
              },
              "value": {
                "type": "string"
              }
            },
            "required": [
              "action",
              "locator",
              "value"
            ],
            "additionalProperties": false
          },
          {
            "type": "object",
            "properties": {
              "action": {
                "const": "check"
              },
              "locator": {
                "oneOf": [
                  {
                    "type": "object",
                    "properties": {
                      "css": {
                        "type": "string",
                        "minLength": 1
                      }
                    },
                    "required": [
                      "css"
                    ],
                    "additionalProperties": false
                  },
                  {
                    "type": "object",
                    "properties": {
                      "role": {
                        "type": "string",
                        "minLength": 1
                      },
                      "name": {
                        "type": "string",
                        "minLength": 1
                      }
                    },
                    "required": [
                      "role",
                      "name"
                    ],
                    "additionalProperties": false
                  }
                ]
              }
            },
            "required": [
              "action",
              "locator"
            ],
            "additionalProperties": false
          },
          {
            "type": "object",
            "properties": {
              "action": {
                "const": "uncheck"
              },
              "locator": {
                "oneOf": [
                  {
                    "type": "object",
                    "properties": {
                      "css": {
                        "type": "string",
                        "minLength": 1
                      }
                    },
                    "required": [
                      "css"
                    ],
                    "additionalProperties": false
                  },
                  {
                    "type": "object",
                    "properties": {
                      "role": {
                        "type": "string",
                        "minLength": 1
                      },
                      "name": {
                        "type": "string",
                        "minLength": 1
                      }
                    },
                    "required": [
                      "role",
                      "name"
                    ],
                    "additionalProperties": false
                  }
                ]
              }
            },
            "required": [
              "action",
              "locator"
            ],
            "additionalProperties": false
          },
          {
            "type": "object",
            "properties": {
              "action": {
                "const": "select_option"
              },
              "locator": {
                "oneOf": [
                  {
                    "type": "object",
                    "properties": {
                      "css": {
                        "type": "string",
                        "minLength": 1
                      }
                    },
                    "required": [
                      "css"
                    ],
                    "additionalProperties": false
                  },
                  {
                    "type": "object",
                    "properties": {
                      "role": {
                        "type": "string",
                        "minLength": 1
                      },
                      "name": {
                        "type": "string",
                        "minLength": 1
                      }
                    },
                    "required": [
                      "role",
                      "name"
                    ],
                    "additionalProperties": false
                  }
                ]
              },
              "value": {
                "type": "string"
              }
            },
            "required": [
              "action",
              "locator",
              "value"
            ],
            "additionalProperties": false
          },
          {
            "type": "object",
            "properties": {
              "action": {
                "const": "wait_for_selector"
              },
              "locator": {
                "oneOf": [
                  {
                    "type": "object",
                    "properties": {
                      "css": {
                        "type": "string",
                        "minLength": 1
                      }
                    },
                    "required": [
                      "css"
                    ],
                    "additionalProperties": false
                  },
                  {
                    "type": "object",
                    "properties": {
                      "role": {
                        "type": "string",
                        "minLength": 1
                      },
                      "name": {
                        "type": "string",
                        "minLength": 1
                      }
                    },
                    "required": [
                      "role",
                      "name"
                    ],
                    "additionalProperties": false
                  }
                ]
              }
            },
            "required": [
              "action",
              "locator"
            ],
            "additionalProperties": false
          }
        ]
      },
      "minItems": 1
    },
    "observe": {
      "type": "array",
      "items": {
        "oneOf": [
          {
            "type": "object",
            "properties": {
              "css": {
                "type": "string",
                "minLength": 1
              }
            },
            "required": [
              "css"
            ],
            "additionalProperties": false
          },
          {
            "type": "object",
            "properties": {
              "role": {
                "type": "string",
                "minLength": 1
              },
              "name": {
                "type": "string",
                "minLength": 1
              }
            },
            "required": [
              "role",
              "name"
            ],
            "additionalProperties": false
          }
        ]
      }
    },
    "environment": {
      "type": "object",
      "properties": {
        "viewport": {
          "type": "object",
          "properties": {
            "width": {
              "type": "integer",
              "minimum": 1
            },
            "height": {
              "type": "integer",
              "minimum": 1
            }
          },
          "required": [
            "width",
            "height"
          ],
          "additionalProperties": false
        },
        "locale": {
          "type": "string",
          "minLength": 1
        },
        "timeout_ms": {
          "type": "integer",
          "minimum": 1
        }
      },
      "required": [],
      "additionalProperties": false
    },
    "evidence_options": {
      "type": "object",
      "properties": {
        "screenshots": {
          "type": "boolean"
        },
        "mask_selectors": {
          "type": "array",
          "items": {
            "type": "string",
            "minLength": 1
          }
        }
      },
      "required": [],
      "additionalProperties": false
    }
  },
  "required": [
    "schema_version",
    "id",
    "category",
    "url",
    "element",
    "symptom",
    "priority",
    "initial_state",
    "expected",
    "authorization",
    "scenario"
  ],
  "additionalProperties": false
}